{
  "version": "1.0.0",
  "profile_id": "vertical_slice_default",
  "description": "Single-wave baseline profile for first-playable loop.",
  "start_state": {
    "day": 1,
    "hp": 20,
    "gold": 10,
    "threat": 0,
    "lesson_id": "full_alpha",
    "practice_mode": false
  },
  "wave": {
    "spawn_total": 32,
    "spawn_interval_sec": 2.5,
    "enemy_step_interval_sec": 1.4,
    "enemy_step_distance": 1,
    "enemy_contact_damage": 1,
    "typed_hit_damage": 2,
    "typed_miss_damage": 1,
    "tower_tick_damage": 1
  }
}
